{"schema_version":"resume-ir.ocr-query-publication.v1","artifact_id":"ocr-query-publication-issue-342","issue":"#342","source":"public_synthetic_repeated_ocr_publication","revision":"2fcf6174a5e2774ed4ea65efd40347124bc5f956","platform":{"os":"macos","architecture":"arm64","machine":"M4","governor":"H2_Aggressive","memory_measurement":"process_tree_rss_mib"},"run":{"kind":"formal_public_witness","seed":20260803,"publication_count":3,"query_attempts":24,"all_publications_observed":true,"epoch_steps_exact":true,"oracle_corruption_probe_passed":true,"transport_probe_passed":true,"protocol_probe_passed":true,"process_cleanup_passed":true,"host_load_guard_passed":true},"fixed_workload":{"model_id":"intfloat-multilingual-e5-small-qint8-r1","dimension":384,"resident_topology":"shared_i3","resident_threads":3,"interactive_batch":1,"publication_batch_bound":4,"ocr_jobs_per_tick":1,"query_modes":["fulltext","semantic","hybrid"],"top_k":1,"deadline_ms":10000,"oracle":"stable_dominant_synthetic_anchor","publication_source":"rasterized_public_synthetic_pdf","mode_order_schedule":[["hybrid","fulltext","semantic"],["fulltext","semantic","hybrid"],["semantic","hybrid","fulltext"]],"client_excess_ms":20,"unclassified_excess_ms":15,"minimum_first_to_warm_ratio":1.5,"required_signal_epochs":2},"observability":{"first_definition":"first_mode_local_request_after_visible_epoch_advance","warm_definition":"immediate_same_mode_repeat_in_same_epoch","residual_label":"unclassified_query_service_embedding_or_queue_wall","direct_queue_wait_telemetry_available":false,"queue_wait_claimed":false,"mode_order_position_reported":true},"stable_control":{"mode_order":["fulltext","semantic","hybrid"],"samples":{"fulltext":{"first":{"outcome":"exact_expected","client_wall_ms":30,"server_latency_ms":29,"stage_latency_ms":{"parse":0,"prefilter":0,"bm25":0,"ann":0,"fusion":0,"bulk_hydrate":0,"snippet":0},"unclassified_wall_ms":29},"warm":{"outcome":"exact_expected","client_wall_ms":28,"server_latency_ms":27,"stage_latency_ms":{"parse":0,"prefilter":0,"bm25":0,"ann":0,"fusion":0,"bulk_hydrate":0,"snippet":0},"unclassified_wall_ms":27}},"semantic":{"first":{"outcome":"exact_expected","client_wall_ms":40,"server_latency_ms":39,"stage_latency_ms":{"parse":0,"prefilter":0,"bm25":0,"ann":0,"fusion":0,"bulk_hydrate":0,"snippet":0},"unclassified_wall_ms":39},"warm":{"outcome":"exact_expected","client_wall_ms":38,"server_latency_ms":37,"stage_latency_ms":{"parse":0,"prefilter":0,"bm25":0,"ann":0,"fusion":0,"bulk_hydrate":0,"snippet":0},"unclassified_wall_ms":37}},"hybrid":{"first":{"outcome":"exact_expected","client_wall_ms":35,"server_latency_ms":34,"stage_latency_ms":{"parse":0,"prefilter":0,"bm25":0,"ann":0,"fusion":0,"bulk_hydrate":0,"snippet":0},"unclassified_wall_ms":34},"warm":{"outcome":"exact_expected","client_wall_ms":33,"server_latency_ms":32,"stage_latency_ms":{"parse":0,"prefilter":0,"bm25":0,"ann":0,"fusion":0,"bulk_hydrate":0,"snippet":0},"unclassified_wall_ms":32}}},"resources":{"process_tree_rss_mib":800,"normalized_one_minute_load":0.2,"status_embedding_queue_depth_before":0,"status_embedding_queue_depth_after":0,"ocr_queue_depth_after":0}},"epochs":[{"ordinal":1,"mode_order":["hybrid","fulltext","semantic"],"samples":{"fulltext":{"first":{"outcome":"exact_expected","client_wall_ms":32,"server_latency_ms":31,"stage_latency_ms":{"parse":0,"prefilter":0,"bm25":0,"ann":0,"fusion":0,"bulk_hydrate":0,"snippet":0},"unclassified_wall_ms":31},"warm":{"outcome":"exact_expected","client_wall_ms":28,"server_latency_ms":27,"stage_latency_ms":{"parse":0,"prefilter":0,"bm25":0,"ann":0,"fusion":0,"bulk_hydrate":0,"snippet":0},"unclassified_wall_ms":27}},"semantic":{"first":{"outcome":"exact_expected","client_wall_ms":120,"server_latency_ms":119,"stage_latency_ms":{"parse":0,"prefilter":0,"bm25":0,"ann":0,"fusion":0,"bulk_hydrate":0,"snippet":0},"unclassified_wall_ms":119},"warm":{"outcome":"exact_expected","client_wall_ms":60,"server_latency_ms":59,"stage_latency_ms":{"parse":0,"prefilter":0,"bm25":0,"ann":0,"fusion":0,"bulk_hydrate":0,"snippet":0},"unclassified_wall_ms":59}},"hybrid":{"first":{"outcome":"exact_expected","client_wall_ms":150,"server_latency_ms":149,"stage_latency_ms":{"parse":0,"prefilter":0,"bm25":0,"ann":0,"fusion":0,"bulk_hydrate":0,"snippet":0},"unclassified_wall_ms":149},"warm":{"outcome":"exact_expected","client_wall_ms":70,"server_latency_ms":69,"stage_latency_ms":{"parse":0,"prefilter":0,"bm25":0,"ann":0,"fusion":0,"bulk_hydrate":0,"snippet":0},"unclassified_wall_ms":69}}},"resources":{"process_tree_rss_mib":820,"normalized_one_minute_load":0.21,"status_embedding_queue_depth_before":1,"status_embedding_queue_depth_after":0,"ocr_queue_depth_after":2}},{"ordinal":2,"mode_order":["fulltext","semantic","hybrid"],"samples":{"fulltext":{"first":{"outcome":"exact_expected","client_wall_ms":31,"server_latency_ms":30,"stage_latency_ms":{"parse":0,"prefilter":0,"bm25":0,"ann":0,"fusion":0,"bulk_hydrate":0,"snippet":0},"unclassified_wall_ms":30},"warm":{"outcome":"exact_expected","client_wall_ms":29,"server_latency_ms":28,"stage_latency_ms":{"parse":0,"prefilter":0,"bm25":0,"ann":0,"fusion":0,"bulk_hydrate":0,"snippet":0},"unclassified_wall_ms":28}},"semantic":{"first":{"outcome":"exact_expected","client_wall_ms":110,"server_latency_ms":109,"stage_latency_ms":{"parse":0,"prefilter":0,"bm25":0,"ann":0,"fusion":0,"bulk_hydrate":0,"snippet":0},"unclassified_wall_ms":109},"warm":{"outcome":"exact_expected","client_wall_ms":55,"server_latency_ms":54,"stage_latency_ms":{"parse":0,"prefilter":0,"bm25":0,"ann":0,"fusion":0,"bulk_hydrate":0,"snippet":0},"unclassified_wall_ms":54}},"hybrid":{"first":{"outcome":"exact_expected","client_wall_ms":140,"server_latency_ms":139,"stage_latency_ms":{"parse":0,"prefilter":0,"bm25":0,"ann":0,"fusion":0,"bulk_hydrate":0,"snippet":0},"unclassified_wall_ms":139},"warm":{"outcome":"exact_expected","client_wall_ms":70,"server_latency_ms":69,"stage_latency_ms":{"parse":0,"prefilter":0,"bm25":0,"ann":0,"fusion":0,"bulk_hydrate":0,"snippet":0},"unclassified_wall_ms":69}}},"resources":{"process_tree_rss_mib":830,"normalized_one_minute_load":0.22,"status_embedding_queue_depth_before":1,"status_embedding_queue_depth_after":0,"ocr_queue_depth_after":1}},{"ordinal":3,"mode_order":["semantic","hybrid","fulltext"],"samples":{"fulltext":{"first":{"outcome":"exact_expected","client_wall_ms":33,"server_latency_ms":32,"stage_latency_ms":{"parse":0,"prefilter":0,"bm25":0,"ann":0,"fusion":0,"bulk_hydrate":0,"snippet":0},"unclassified_wall_ms":32},"warm":{"outcome":"exact_expected","client_wall_ms":30,"server_latency_ms":29,"stage_latency_ms":{"parse":0,"prefilter":0,"bm25":0,"ann":0,"fusion":0,"bulk_hydrate":0,"snippet":0},"unclassified_wall_ms":29}},"semantic":{"first":{"outcome":"exact_expected","client_wall_ms":60,"server_latency_ms":59,"stage_latency_ms":{"parse":0,"prefilter":0,"bm25":0,"ann":0,"fusion":0,"bulk_hydrate":0,"snippet":0},"unclassified_wall_ms":59},"warm":{"outcome":"exact_expected","client_wall_ms":55,"server_latency_ms":54,"stage_latency_ms":{"parse":0,"prefilter":0,"bm25":0,"ann":0,"fusion":0,"bulk_hydrate":0,"snippet":0},"unclassified_wall_ms":54}},"hybrid":{"first":{"outcome":"exact_expected","client_wall_ms":80,"server_latency_ms":79,"stage_latency_ms":{"parse":0,"prefilter":0,"bm25":0,"ann":0,"fusion":0,"bulk_hydrate":0,"snippet":0},"unclassified_wall_ms":79},"warm":{"outcome":"exact_expected","client_wall_ms":75,"server_latency_ms":74,"stage_latency_ms":{"parse":0,"prefilter":0,"bm25":0,"ann":0,"fusion":0,"bulk_hydrate":0,"snippet":0},"unclassified_wall_ms":74}}},"resources":{"process_tree_rss_mib":840,"normalized_one_minute_load":0.23,"status_embedding_queue_depth_before":1,"status_embedding_queue_depth_after":0,"ocr_queue_depth_after":0}}],"outcomes":{"attempted":24,"counts":{"exact_expected":24,"valid_epoch_result_change":0,"deadline_partial":0,"semantic_partial":0,"overload":0,"http_error":0,"protocol_error":0,"transport_error":0,"cancelled":0},"completed_valid":24,"degraded_or_failed":0,"count_conserved":true},"mode_aggregates":{"fulltext":{"epoch_pairs":3,"complete_epoch_pairs":3,"first_client_ms":{"p50":32,"p95":33,"p99":33,"max":33},"warm_client_ms":{"p50":29,"p95":30,"p99":30,"max":30},"first_minus_warm_ms":{"p50":3,"p95":4,"p99":4,"max":4},"excess_over_control_ms":{"p50":1,"p95":2,"p99":2,"max":2},"unclassified_excess_over_control_ms":{"p50":1,"p95":2,"p99":2,"max":2},"signal_epochs":0},"semantic":{"epoch_pairs":3,"complete_epoch_pairs":3,"first_client_ms":{"p50":110,"p95":120,"p99":120,"max":120},"warm_client_ms":{"p50":55,"p95":60,"p99":60,"max":60},"first_minus_warm_ms":{"p50":55,"p95":60,"p99":60,"max":60},"excess_over_control_ms":{"p50":53,"p95":58,"p99":58,"max":58},"unclassified_excess_over_control_ms":{"p50":53,"p95":58,"p99":58,"max":58},"signal_epochs":2},"hybrid":{"epoch_pairs":3,"complete_epoch_pairs":3,"first_client_ms":{"p50":140,"p95":150,"p99":150,"max":150},"warm_client_ms":{"p50":70,"p95":75,"p99":75,"max":75},"first_minus_warm_ms":{"p50":70,"p95":80,"p99":80,"max":80},"excess_over_control_ms":{"p50":68,"p95":78,"p99":78,"max":78},"unclassified_excess_over_control_ms":{"p50":68,"p95":78,"p99":78,"max":78},"signal_epochs":2}},"diagnosis":{"status":"diagnosed","selected_next_action":"resident_isolation_rerun","fulltext_signal":false,"semantic_or_hybrid_signal":true,"signal_epoch_counts":{"fulltext":0,"semantic":2,"hybrid":2},"outcome_integrity_passed":true,"no_speedup_claim":true,"no_query_hot_path_acceptance_claim":true},"privacy":{"contains_private_paths":false,"contains_filenames":false,"contains_resume_text":false,"contains_query_text":false,"contains_candidate_results":false,"contains_document_or_version_ids":false,"contains_token_ids":false,"contains_vectors":false,"contains_pids":false,"contains_logs_or_traces":false,"contains_direct_raw_hashes":false,"contains_databases_or_indexes":false,"contains_model_or_runtime_bytes":false},"claims":["diagnostic_only","no_product_speedup"